{
  "schema": "ace.opponent-profile",
  "schema_version": 1,
  "feature_set_version": 1,
  "profile_id": "neutral-v1",
  "display_name": "Neutral profile",
  "created_at": "2026-08-31T00:00:00+05:30",
  "provenance": {"source": "neutral", "games": 0, "positions": 0, "notes": "Canonical zero-effect fallback profile."},
  "feature_weights": {
    "capture_value_cp": 0, "promotion_gain_cp": 0, "gives_check": 0, "legal_reply_count": 0,
    "material_balance_cp": 0, "material_imbalance_cp": 0, "remaining_non_pawn_material_cp": 0,
    "remaining_pawn_count": 0, "open_file_count": 0, "mobility_balance": 0, "king_safety_balance": 0,
    "pawn_structure_balance": 0, "center_control_balance": 0, "pawn_tension_count": 0, "irreversible": 0, "castles": 0
  },
  "feature_confidence": {
    "capture_value_cp": 0, "promotion_gain_cp": 0, "gives_check": 0, "legal_reply_count": 0,
    "material_balance_cp": 0, "material_imbalance_cp": 0, "remaining_non_pawn_material_cp": 0,
    "remaining_pawn_count": 0, "open_file_count": 0, "mobility_balance": 0, "king_safety_balance": 0,
    "pawn_structure_balance": 0, "center_control_balance": 0, "pawn_tension_count": 0, "irreversible": 0, "castles": 0
  }
}
