{
  "schema": "ace.opponent-profile",
  "schema_version": 1,
  "feature_set_version": 1,
  "profile_id": "synthetic-complexity-pressure-v1",
  "display_name": "Synthetic complexity pressure",
  "created_at": "2026-08-31T00:00:00+05:30",
  "provenance": {
    "source": "synthetic",
    "games": 0,
    "positions": 0,
    "notes": "Experimental policy that preserves pieces and choices while increasing tension, imbalance, and commitment."
  },
  "feature_weights": {
    "capture_value_cp": 0,
    "promotion_gain_cp": 0,
    "gives_check": 0,
    "legal_reply_count": 450,
    "material_balance_cp": 0,
    "material_imbalance_cp": 600,
    "remaining_non_pawn_material_cp": 850,
    "remaining_pawn_count": 300,
    "open_file_count": 250,
    "mobility_balance": 350,
    "king_safety_balance": 0,
    "pawn_structure_balance": 0,
    "center_control_balance": 0,
    "pawn_tension_count": 750,
    "irreversible": 450,
    "castles": 0
  },
  "feature_confidence": {
    "capture_value_cp": 0,
    "promotion_gain_cp": 0,
    "gives_check": 0,
    "legal_reply_count": 1000,
    "material_balance_cp": 0,
    "material_imbalance_cp": 1000,
    "remaining_non_pawn_material_cp": 1000,
    "remaining_pawn_count": 1000,
    "open_file_count": 1000,
    "mobility_balance": 1000,
    "king_safety_balance": 0,
    "pawn_structure_balance": 0,
    "center_control_balance": 0,
    "pawn_tension_count": 1000,
    "irreversible": 1000,
    "castles": 0
  }
}
